doc_id,category,question,answer,handoff_note
FAQ-001,billing,Can I change my billing date?,"Yes. In this fictional ACME Life sample, customers can request one billing-date change per month before the next invoice is issued.","Owner: billing operations. Check policy before using in production."
FAQ-002,claims,Which documents are needed for a claim?,"Use the synthetic claim checklist: claim form, identity confirmation, service receipt, and event summary. Do not collect real documents in this demo.","Owner: claims operations. Replace with reviewed public guidance only."
FAQ-003,login,How do I reset my password?,"Use the account recovery page, verify your identity, and set a new password. Support agents should never ask for the existing password.","Owner: customer support. Keep password guidance aligned with security policy."
FAQ-004,cancellation,Can I cancel during the cooling off period?,"In this fictional sample, cancellation is allowed within the stated cooling-off window if no claim has been paid. Route edge cases to a licensed specialist.","Owner: compliance. Legal review required before real use."
FAQ-005,status,How can I check request status?,"Use the request-status page or contact support with the synthetic request id. Show only customer-facing statuses and do not expose internal workflow states.","Owner: service operations. Confirm which statuses are customer-facing."
